{
  "$schema": "https://json-schema.org/draft/2020-12/schema",
  "$id": "https://tars.local/schemas/trading-event.schema.json",
  "title": "TARSTradingEvent",
  "description": "Canonical trading event contract shared by TARS backend, laptop UI, iPhone UI, ESP32 (future), and the quant_brain adapter (future). This is a companion/informational event, not a trade instruction. Do not add any AI confidence/probability field to this schema; see docs/coordination/DECISIONS.md ADR-004.",
  "type": "object",
  "additionalProperties": false,
  "required": [
    "schema_version",
    "event_id",
    "timestamp",
    "source",
    "symbol",
    "state",
    "validation_status"
  ],
  "properties": {
    "schema_version": {
      "type": "string",
      "const": "1.0.0",
      "description": "Contract version. Bump on any breaking change and record a new ADR in DECISIONS.md."
    },
    "event_id": {
      "type": "string",
      "format": "uuid",
      "description": "Unique identifier for this event instance."
    },
    "timestamp": {
      "type": "string",
      "format": "date-time",
      "description": "ISO 8601 timestamp of when this event was emitted."
    },
    "source": {
      "type": "string",
      "enum": ["mock", "quant_brain", "manual"],
      "description": "Origin of the event. V1 uses 'mock' exclusively; 'quant_brain' is reserved for the future real integration; 'manual' is reserved for user/coordinator-authored test events."
    },
    "symbol": {
      "type": "string",
      "minLength": 1,
      "description": "Instrument symbol this event concerns, e.g. 'XAUUSD', 'ES'."
    },
    "strategy_id": {
      "type": ["string", "null"],
      "description": "Identifier of the strategy that produced this event, if applicable. Null for system-level events (e.g. SYSTEM_WARNING)."
    },
    "state": {
      "type": "string",
      "enum": [
        "IDLE",
        "SETUP_DEVELOPING",
        "SETUP_VALID",
        "SETUP_INVALIDATED",
        "RISK_WARNING",
        "SYSTEM_WARNING"
      ],
      "description": "Lifecycle state this event represents."
    },
    "direction": {
      "type": ["string", "null"],
      "enum": ["LONG", "SHORT", "NONE", null],
      "description": "Directional bias of the setup, if any. Null/NONE for non-directional or system-level events."
    },
    "entry": {
      "type": ["number", "null"],
      "description": "Proposed entry price, if applicable."
    },
    "stop_loss": {
      "type": ["number", "null"],
      "description": "Stop loss price, if applicable."
    },
    "take_profit": {
      "type": ["number", "null"],
      "description": "Take profit price, if applicable."
    },
    "risk_reward": {
      "type": ["number", "null"],
      "description": "Risk:reward ratio for the setup, if applicable."
    },
    "risk_percent": {
      "type": ["number", "null"],
      "minimum": 0,
      "description": "Risk expressed as a percentage of account/reference size, if applicable. Informational only; TARS never sizes or places trades."
    },
    "validation_status": {
      "type": "string",
      "enum": ["PENDING", "VALID", "INVALID", "EXPIRED"],
      "description": "Validation status of this event's underlying setup, distinct from lifecycle 'state'."
    },
    "reason_codes": {
      "type": "array",
      "items": { "type": "string" },
      "default": [],
      "description": "Machine-readable codes explaining why this event/state was produced (e.g. why a setup was invalidated)."
    },
    "warnings": {
      "type": "array",
      "items": { "type": "string" },
      "default": [],
      "description": "Human-readable warning strings associated with this event, e.g. risk or data-quality warnings."
    },
    "expires_at": {
      "type": ["string", "null"],
      "format": "date-time",
      "description": "ISO 8601 timestamp after which this event/setup should be considered stale by consumers. Null if not applicable."
    }
  }
}
