{
  "schema_version": "1.0.0",
  "event_id": "00000000-0000-4000-8000-000000000006",
  "timestamp": "2026-08-16T08:05:00Z",
  "source": "mock",
  "symbol": "TARS",
  "strategy_id": null,
  "state": "SYSTEM_WARNING",
  "direction": null,
  "entry": null,
  "stop_loss": null,
  "take_profit": null,
  "risk_reward": null,
  "risk_percent": null,
  "validation_status": "PENDING",
  "reason_codes": ["MARKET_DATA_STALE"],
  "warnings": ["Mock market data heartbeat is stale."],
  "expires_at": null
}
