{
  "schema_version": "1.0.0",
  "event_id": "00000000-0000-4000-8000-000000000005",
  "timestamp": "2026-08-16T08:04:00Z",
  "source": "mock",
  "symbol": "ES",
  "strategy_id": "reversal-v2",
  "state": "RISK_WARNING",
  "direction": "SHORT",
  "entry": 6480.25,
  "stop_loss": 6488.25,
  "take_profit": 6464.25,
  "risk_reward": 2.0,
  "risk_percent": 1.25,
  "validation_status": "PENDING",
  "reason_codes": ["RISK_LIMIT_NEAR"],
  "warnings": ["Configured informational risk threshold is near."],
  "expires_at": "2026-08-16T08:19:00Z"
}
